title,score,id,url,comms_num,created,body,timestamp
Comment,1,gmuakil,,0,1613008686.0,My arm is super sore just like the first one. It’s been about 16 hours and I feel fine aside from that! Nothing else so far. No aches or fever or chills. Woohoo!,2021-02-11 03:58:06
Comment,1,gmty6nk,,0,1613003460.0,How are you feeling today?,2021-02-11 02:31:00
Comment,1,gmtvooy,,0,1613002395.0,"I had my second dose on Monday.. So far all I've had is some fatigue and a really sore shoulder. 48 hours after the first vaccine I had exhaustion, headache and nausea. Will be interesting to see if it kicks in later today.",2021-02-11 02:13:15
Comment,2,gmthpot,,0,1612996144.0,"Watch Pfizer censor your post...


And mine !!!",2021-02-11 00:29:04
Comment,2,gmthf78,,0,1612996005.0,I’m so sorry 😢 I keep trying to get the word out that THAT vaccine is not approved by the FDA for safety or efficacy!!! Anyone getting it is trusting the pharmaceutical companies with their life and you can’t sue ANYONE for damages!!! Authorization is not FDA approved!!! Please tell everyone because the pharmaceutical companies are laughing all the way to the bank. Why do people SUDDENLY believe they give a shit about anything except profits?!!  I’m so sorry for your loss!!!!,2021-02-11 00:26:45
Comment,0,gmtb8a9,,0,1612992717.0,"You are a lab rat 🐀 for a vaccine that has not been approved for safety or efficacy by the FDA AND you can still get covid. If you have long term disability or side effects, you can’t sue ANYONE!!!",2021-02-10 23:31:57
Comment,0,gmtb11f,,0,1612992599.0,"All that and guess what, you can still get covid?  That’s not a cure. It’s not even FDA APPROVED. You volunteered to inject yourself with a drug that has not been approved for safety or efficacy. Good luck to you.",2021-02-10 23:29:59
Comment,2,gmt9wbk,,0,1612991920.0,"There is no FDA approved vaccine for covid. AUTHORIZATION is not FDA approval!!! They are VERY different things. You are basically a volunteer test subject for the pharmaceutical companies. You can’t sue anyone if you have adverse effects or allergic reactions. No one!!! The media is not showing African protests over their population being used as test subjects. It appears that suddenly the pharmaceutical companies are trusted by USA and other countries now? Purdue pharmaceutical company just settled for $9 billion dollars for lying to people about OxyContin and its addiction yet, people believe that they care about your health?!! 

I got censored for stating what is on the CDC website and the WHO website. You can also still get covid after the Pfizer or Moderna vaccine. People have gone into anaphylactic shock after the first dose.  Be sure anyone willing to get the vaccine understands the risks. An Epi-pen is required to be at EVERY vaccination center.!! Per the CDC WEBSITE “MOST PEOPLE RECOVER FROM COVID.”  If this post gets censored for quoting the CDC’s own website, be very concerned!!!",2021-02-10 23:18:40
Comment,2,gmt5i6c,,0,1612989034.0,Different Health boards in Wales are administering the second dose either 3 weeks after the first or 12 weeks after the first - this is dependant on whether your health board is looking to get more people fully vaccinated first over more first jabs spread out over the population. Your health board will contact you when it is time for your next jab though but recommendations from Pfizer are to have at least a 3 week waiting period between jabs,2021-02-10 22:30:34
Comment,1,gmswe87,,0,1612981000.0,"The Pfizer jab killed my Dad last week. He was fine, albeit elderly and loved a moan at how lazy the kids of today are. 2 days after the Jab he complained of nausea, we found him dead on the sofa last Wednesday. Boris is beta testing the jab on the GB population.",2021-02-10 20:16:40
Comment,2,gmsaa78,,0,1612962256.0,"Some people have only had mild effects (or even none) so it’s hard to say for sure what you may experience. Of the people I know personally who have had a stronger reaction like I did, it was only for one day. I started feeling the chills and aches approx 10ish hours  after the vaccine and then immediately slept all night before my full day of feeling bad. I would say definitely REST, regardless of how you are feeling, as much as possible for the next 24-48 hours so your body can do what it needs to do. Don’t stay up late, don’t eat junk, keep hydrated, and just rest/sleep any time you don’t have to be at work. I hope you are one of the lucky ones who doesn’t have it too bad. Also, some people have been worried about taking pain relievers for their symptoms for fear of it causing the vaccine to not work as well. But it is ok to take a little something if you feel really awful AFTER a vaccine. So don’t hesitate if you do feel bad.",2021-02-10 15:04:16
Comment,2,gms4m5y,,0,1612958879.0,"I just my 2nd dose 3 hours ago. 

I work the rest of this week, W-F, 12 hour shifts. I’m  really nervous for how I might feel tomorrow. I can’t miss work so I will have to power through whatever happens. 

I’ve been stretching my arm like crazy and drinking water hoping that I can stay on top of whatever comes and avoid the sore stiff feeling. 


With the first one I think I had some joint pain, a small head ache, and a severely sore arm. 


I’m just so anxious for how much this might affect me at work tomorrow or even Thursday.",2021-02-10 14:07:59
Comment,1,gmrt4vl,,0,1612952709.0,I got that after the first dose. It went away after a couple days. That's normal,2021-02-10 12:25:09
Comment,2,gmrsv7x,,0,1612952569.0,Bullshit,2021-02-10 12:22:49
Comment,1,gmrm0um,,0,1612948972.0,"Got my first dose 1/28 and not sure if i was feeling fatigue because of working two 12 hr shifts in a row but i did have injection site soreness after 3 hours from receiving the vaccine, then around 5-6 hours later i had a couple rashes on the arm of the injection site, took clairitin and it went away, my soreness probably lasted another day but i just kept moving that arm and stretching which helped",2021-02-10 11:22:52
Comment,3,gmrku9k,,0,1612948358.0,Source?,2021-02-10 11:12:38
Comment,3,gmrkt9s,,0,1612948343.0,Had my dose 2 shot. Right feeling a slight headache and pain in arm but so far that’s it. I’ll keep updating,2021-02-10 11:12:23
Comment,3,gmrimss,,0,1612947204.0,"Received 1st dose 11:30 am Feb 7, Left Deltoid 
About 6hrs later achey upper left arm.  No other adverse effects to report 
Actually slept better knowing I’ll be protected after second dose.  I am overweight 60 yo F with COPD",2021-02-10 10:53:24
Comment,1,gmr11hm,,0,1612938322.0,Would I be able to have my vaccine at 19days after first dose I wonder?,2021-02-10 08:25:22
Comment,1,gmp7t5i,,0,1612909965.0,Here is the pattern of the Big guys. They buy later shares at the end of the day then sell them premarket the next day. They are trying to short the stock down to 33. We need to turn the tide on them. The little players need to gain control.,2021-02-10 00:32:45
Comment,3,gmp2ptj,,0,1612907191.0,No source.,2021-02-09 23:46:31
Comment,1,gmnx476,,0,1612873684.0,"Immediately-1hr I also felt nothing.

1-6hrs kind of sore at arm but nothing else

12hrs- Arm sore, sort of nauseous, tired",2021-02-09 14:28:04
Comment,1,gmm85sf,,0,1612843198.0,"What will it take to move Pfizer, should I short it like the big guys?",2021-02-09 05:59:58
Comment,1,gmjo1b8,,0,1612784927.0,Q4 Report has past... any clues to why $PFE is still around the same #,2021-02-08 13:48:47
Comment,1,gmjnykx,,0,1612784883.0,2/2 has past 🤔 hasnt 🚀... any clues to why & when should we see it 🚀,2021-02-08 13:48:03
Comment,1,gmjlkwy,,0,1612783522.0,"I had the same reaction to the 2nd dose... fever 102, chills, really bad muscle aches and joint pain, aaaand massive axillary lymph node swelling on injection site side... like the size of a cue ball. It’s gone down since onset on Friday, but it has been rough.",2021-02-08 13:25:22
Comment,3,gmi7dvx,,0,1612760203.0,I got my first dose on Thursday 2/4. So today is 3 rd full day since. I was really really tired yesterday afternoon (48 hrs) had brain fog like I'd taken a sleeping pill and was trying to fight through it. Last night I slept about 10-11 hrs. I usually wake up naturally at 5 am and slept until 8:45. I have t done that in years. All day I have felt so tired I could barely move from the couch and fell asleep for a few hours in the middle of the day. Dizzy upon waking up. Not unbearable whatsoever but just reporting my experience. I'm so happy to have gotten this vaccine. Super Bowl Sunday in the middle of the time so I don't have to go anywhere and can lie on the couch all day.,2021-02-08 06:56:43
Comment,1,gmhn3ft,,0,1612752805.0,"I just got my second dose Wednesday.

My first dose symptoms kicked in on day 2 and 3 the hardest. I felt waves of just... Feeling icky and fatigued, slightly nauseated. Pain in my armpit (weird but ok, didn't think much of it then)

2.5 weeks later
Second dose, much bigger reaction. Next day I'm feeling waves of Runny nose, chills, upset stomach, and fatigued. Then swelling started in my arm pit and the underside of my arm which received the injection.  Freaked out, I look it up and found that this is turning out to be a known side effect. Yesterday the swelling was big and slightly warmer to the touch, uncomfortable. I took tylenol and it helped WAY more than Ibuprofen did. Last night before bed the site got itchy and gave me some little hives but those went away. I slept in a bit extra and I'm feeling much better today, lymph swelling is way down. No icky waves yet.

I should mention I'm technically obese and have some skin problems like allergies to fragrances and psoriasis. I was eager to get the vaccine but feel kinda bummed it hit so hard. I want to encourage others to get it ASAP but want to be transparent that the side effects are a bit uncomfortable. If anyone has feedback for me I'm all ears.
Has anyone else had the swollen armpit???",2021-02-08 04:53:25
Comment,1,gmg8uoi,,0,1612740199.0,"Glad to hear it’s a little better. It seems like several people have had tachycardia (HR>100) after the vaccine. Mine lasted about 10 days, which I think is the exception to the rule. Today is the first day I think I’m in the clear. If it is persistent, you can always ask your PCP or a cardiologist for something to temporarily slow your heart rate down to get you through those episodes. Hope you feel better!",2021-02-08 01:23:19
Comment,1,gmeobz2,,0,1612725802.0,"Oh, so you had trouble sleeping as well! Interesting. I do suspect it might have been from the vaccine as I noticed a different pattern from when I’m just tired or stressed.

Thanks for sharing!",2021-02-07 21:23:22
Comment,1,gme6zkt,,0,1612721419.0,I had my second dose 2/4 and am feeling sore today... my biggest issue is a swollen axillary lymph node under the vaccinated arm... has anyone else experienced that? It’s really painful.,2021-02-07 20:10:19
Comment,2,gm9qlpo,,0,1612672729.0,"Had a sore arm for a few days and fatigue. Felt fine but about 12 days later, had sudden fatigue and headache for a couple of hours for about 4 days. Was concerned bc this happened so many days later",2021-02-07 06:38:49
Comment,2,gm7jm8d,,0,1612622848.0,"Israel Pfizer data from 500,000 people: from the first shot.
(1) NEGATIVE  effectiveness until day 8 (Speculation: People less cautious)
(2) ZERO effectiveness until day 14
(3) Increase day-by-day to ~90% at day 21
(4) No further increase after day 21. 

Original clinical study did not track after day 18. (Recommends 2nd shot in 21 days).",2021-02-06 16:47:28
Comment,1,gm7ckvq,,0,1612617537.0,Okay so it cooled off after that night but my heart rate is still higher than normal lately...,2021-02-06 15:18:57
Comment,5,gm74m5m,,0,1612612574.0,"Had my second shot 10 days ago, can still feel my body adjusting, light head, flush, headache a couple times, but overall not bad and feel grateful",2021-02-06 13:56:14
Comment,1,gm6wa6w,,0,1612607837.0,"I had the Moderna vaccine #2 8 days ago and have been having a racing heart beat, little chest discomfort, sweaty palms/soles that continues to come in waves. Is she still experiencing it, or did it go away? Went to the ER. They couldn’t really say but feel it may be related to the vaccine. Sent me to a cardiologist. Wearing a heart monitor now. I definitely feel this is vaccine related because of the acute onset. Hoping it resolves soon.",2021-02-06 12:37:17
Comment,2,gm6vgt3,,0,1612607395.0,Are you still having the racy heart? Or did it go away after a few days?,2021-02-06 12:29:55
Comment,1,gm62lbd,,0,1612592542.0,I have a slight sore throat too.,2021-02-06 08:22:22
Comment,5,gm62ilc,,0,1612592506.0,Had my first does this morning. I started feeling soreness in my neck on the side that  got my shot after. It felt like I had been sitting on the computer too long. About 2 hours later I felt exhausted-it’s been about 7 hours and I’ve been dozing off all day. I have a little sore throat and my injection site is sore. No fever- it feels like my body is fighting off a cold or flu- not quite sick- but I don’t feel like doing much either.,2021-02-06 08:21:46
Comment,3,gm5du83,,0,1612581339.0,"Got my first dose yesterday. Within thirty minutes I had an elevated heart rate and BP, nausea and sweats. Stayed at clinic until everything went down. Within six hours had body aches and a headache. Now about one day after I have a tight throat and ache, body aches, chills and a low grade fever",2021-02-06 05:15:39
Comment,3,gm2jgor,,0,1612521646.0,I just had my first dose tonight about 4 hrs ago. I’m already starting to feel tired. I also am starting to feel a slight pain in my arm. AND I have a random runny nose lol. That’s it so far.,2021-02-05 12:40:46
Comment,6,gm2h72i,,0,1612520594.0,"33/F I got the first dose Wednesday morning. Immediately after- absolutely nothing, went straight back to work 

Wednesday evening-a little sore at the injection side but very mild

Thursday morning- just a little sore at the injection site, Thursday evening- shoulder slightly sore but also mild and manageable.",2021-02-05 12:23:14
Comment,2,gm1tbq7,,0,1612509355.0,Tachycardia is above 135 I think.  I'd recommend trying a Xanax if a doctor approves.  Or just deal with it.  Try little stimulation.  Dark room.  Silence.  No movement.  Boring thoughts.,2021-02-05 09:15:55
Comment,2,gm1t339,,0,1612509245.0,Can you give me a link to an article saying this plz?,2021-02-05 09:14:05
Comment,2,gm1jedz,,0,1612504988.0,Thanks for the update.,2021-02-05 08:03:08
Comment,2,glz6mou,,0,1612467078.0,"It’s about 50-55% percent on the first shot, then goes up to 95% after the second

Edit: not sure what days these efficiencies kick in after the shot is had, this also does not account for the new strains we are starting to see but they are happy that it is still effective against the new strains",2021-02-04 21:31:18
Comment,2,glz5stk,,0,1612466393.0,"Hi I'm from uk and had mine on 28th jan to,i was so tired for a couple of days after any idea how much immunity we have with one shot?",2021-02-04 21:19:53
Comment,1,glvzz2b,,0,1612404501.0,So glad to know that I’m not the only one!  I asked all of my colleagues to try an “experiment” with eating spicy food and no one else experienced it. My only other reaction was the same armpit swelling and spurned for a few days. I’m 53/m,2021-02-04 04:08:21
Comment,2,glvyja9,,0,1612403963.0,"You are meant to wait 21 days after your first dose and then have the second one.

I had mine on the 28th of January and my second is scheduled for 15th of April - I am UK based",2021-02-04 03:59:23
Comment,8,glvy9td,,0,1612403862.0,"Had mine last Thursday. The next morning I had a sore arm and a bit of a headache but that is not uncommon. 

I wouldn’t worry too much, it is common to feel mild symptoms after a vaccine. It will pass so don’t get too much in your own head about it or you might cause some sort of placebo effect.

I would contact your doctor too because 1) they can reassure you much better than random people on the internet and 2) if anything is seriously wrong with you due to the vaccine then they are the person you should be talking to anyway

Hope you feel better soon",2021-02-04 03:57:42
Comment,3,glvnuv4,,0,1612399714.0,The same thing happened to me!! I drive for work and usually always have Takis in my car to snack on. After getting the first dose I ate like 2 takis and I felt sick because it was so spicy- like I was sweating and had chills. My other side effects were just being SUPER fatigued and my arm/armpit/lymphnodes hurt like hell for a few days. I’m 27/F,2021-02-04 02:48:34
Comment,3,glvmdxo,,0,1612399119.0,Who told you the vaccines are safe?  The government?  The pharmaceutical companies?  The same people that won’t approve them for safety or efficacy?!! 🤬,2021-02-04 02:38:39
Comment,2,glvm73f,,0,1612399041.0,Most people recover from covid at home. You can still get covid even after you get the vaccine. Good luck 👍🏼,2021-02-04 02:37:21
Comment,4,glue2f8,,0,1612373045.0,I've already had both PB vaccines. Sore arm for 24hrs on both occasions but that's all 👍,2021-02-03 19:24:05
Comment,7,glu3vyj,,0,1612364272.0,Getting my second vaccine shot on Tuesday feb 9th. My first dose I had a headache and cloudy headed and took some pills and a nap and woke up fine but had arm soreness for about 3 days before it eventually went away. I’ll be back to discuss my dose 2 journey,2021-02-03 16:57:52
Comment,5,gltghtw,,0,1612350382.0,"I did notice the fatigue the most at the gym because I am going on a very regular base. I did experience headaches and here and there dizziness as well, today is day 10 and I feel better, yet tired...unsure whether more tired than usual or just tired in general...",2021-02-03 13:06:22
Comment,2,gltg8o8,,0,1612350257.0,"Hey there! 
Honestly my progress of the vaccine sounds very similar to what you are experiencing. Today is my Day 10 after and overall I feel a little better and my workout was very energized and good today. However, I did experience sleeping troubles as well. I did have a really long day yesterday, 14 hours of work and was quiet exhausted and slept quiet good until 90mins before my alarm, so I am unsure whether I needed just really exhaust myself to sleep well or if it is the vaccine causing the body to be exhausted due to working in our system! Thanks for sharing your experience! :)",2021-02-03 13:04:17
Comment,4,gltfi2z,,0,1612349895.0,"Hey there! 
I have talked to a friend who is a registered nurse here (Kelowna, BC, Canada), who also received the vaccine.
He however received it two weeks prior me so I asked about his experiences. He told me that he felt like I did, general fatigued and exhausted as well as little energy at the gym for about 8 to 10 days after the vaccine. He stated that it is common for some to have these symptoms for a little while after, however he told me that if you have ANY respiratory issues at all to contact your doctor about it. I so far only felt tired and low energized and here and there dizzy, but today is day 10 post vaccine and I do feel alot better, I will keep you updated, thank you for sharing your experience! :)",2021-02-03 12:58:15
Comment,3,glt17ru,,0,1612342915.0,"Hi, I'm almost 10 days post vaccine and I feel horrible. Everything in my body hurts... I tried doing yoga this morning, which pre-vaccine was easy for me, and I was so out of breath and it felt so hard. Then I tried going on a hike that I usually go on and it felt near impossible. I have headaches in weird places, strange aches and pains, and weakness. 

I feel like I'm getting worse every day at this point and I'm starting feel like... why did I do this?",2021-02-03 11:01:55
Comment,8,glsxmws,,0,1612341184.0,"I got my first dose Saturday. 
On the day of, I felt nauseous and very tired. But was able to sort of get rid of that after eating dinner.

The second and third days, I had a slight sore throat. It isn’t officially listed as a symptom, but I thought I should mention it. 

I’m on the fourth day, and I currently have a bit of a headache and some slight fatigue. Nothing too bad.

I haven’t experienced what you’ve described. But it’s also been less than a week, so we’ll see.",2021-02-03 10:33:04
Comment,1,glsnpwh,,0,1612336488.0,"I trust the scientists and science behind vaccines that have been saving lives for decades. So yes I’m trying to provide some comfort to those who are experiencing post vaccine anxiety— because the vaccine is safe and I guarantee a decent chunk of the reported side effects of heart rate increases are largely due to anxiety. Is the vaccine totally perfect? No, but we don’t really have the time to create the perfect vaccine with zero side effects or risks. These vaccines will save more lives than it will take. So at this point it’s in our country’s best interest to get the current vaccines out. I agree with everything you said, but I don’t think the government is always out to get us...",2021-02-03 09:14:48
Comment,0,glsahxu,,0,1612330839.0,"Yeh I listed 80 vaccines; but you seem to have a short posting memory😂 I quote again what you said, “THERE IS NO FDA APPROVED VACCINE.” BUT THERE ARE 80 OF THEM, AND WHETHER THEY ARE COVID OR NOT, those are vaccines that are approved or do you deny that too. I already stated my reason to take the shot and my concerns leading up to it. I made a choice and obviously you have as well, but don’t lecture the public by saying vaccines are not approved when they are. The Pfizer-BioNTech vaccine has gone through stage 3 trials with just under 50,000 participants prior to the EUA and you are correct, it is not approved yet.",2021-02-03 07:40:39
Comment,1,gls9prv,,0,1612330535.0,🖕🏻,2021-02-03 07:35:35
Comment,1,gls699s,,0,1612329270.0,The smartest? You suddenly trust the government and big pharmaceutical companies with your health? The same government that makes health insurance out of reach for 28 million people? The same pharmaceutical companies that just got sued for $9 billion dollars for lying about OxyContin being addictive?!!! You trust a drug in your body that has not been approved by the FDA?!! 😳,2021-02-03 07:14:30
Comment,1,gls5mom,,0,1612329016.0,The vaccine is not approved by the FDA for safety or efficacy. There is no one liable for any adverse side effects or allergic reactions to the vaccines. You are basically volunteering to be a lab rat.,2021-02-03 07:10:16
Comment,3,gls5eh8,,0,1612328918.0,"Tachycardia is not NORMAL. Anxiety can cause it but if it doesn’t slow down, call your doctor!!!",2021-02-03 07:08:38
Comment,9,glrgr3x,,0,1612319243.0,"Got my first vaccine yesterday.


**Immediately-1hr** nothing, felt normal, no arm soreness


**1hr-6hrs** slight headache (although I think it was because I needed to eat) and tired. Arm started to get sore at about hour 2-3. 


**6 hrs-24 hrs** arm still sore, nothing else to report.

Edit: I did have a small rash around the injection site for days 2-4 . Slightly itchy but nothing bad.",2021-02-03 04:27:23
Comment,1,glrgq41,,0,1612319231.0,"Excuse me, last I checked this Reddit was about taking the Pfizer vaccine. You seem to be caught up on profit margins and lawsuits. If you want to rant about the uninsured or big tobacco or the opioid crisis, why not find a Reddit page for that, I am sure there are plenty on here. My posts are about observations of this vaccine not the aforementioned topics you are discussing. Here is a question to you: Have you taken the vaccine yet, why or why not?",2021-02-03 04:27:11
Comment,4,glrcstv,,0,1612317678.0,"My heart rate gets up to 100 in the middle of the night just from pure anxiety. Just keep reminding yourself that you are going to be fine. Hundreds of thousands of people have gotten the vaccine all around the world and are okay. The few people that have died from the vaccine are those freak occurrences, that is not a normal thing. The smartest scientists in the world made this vaccine and know what they are doing.",2021-02-03 04:01:18
Comment,1,glqqslg,,0,1612309582.0,Did you ask?!!!,2021-02-03 01:46:22
Comment,3,glqfsf8,,0,1612305597.0,"I did have what you are describing as well and felt like I was unable to properly work out because of tiredness.

My full experience was this: 
Vaccination date: first dose of the Pfizer Vaccine Sunday, 24th of January

I have a history of anaphylactic shocks (three) and I administered antihistamines before getting the shot as prevention. I did NOT have any allergic reaction to the vaccine in these conditions.

First 48hrs:
- sore muscle in my arm, where vaccine shot was
- slightly elevated body temperature (37.1)
- slight tiredness and body chills (kind of like when you are very early in catching a cold)
- a bit of nausea

10 days after vaccination:
- I have had trouble sleeping, but this might be attributed to having a stressful period",2021-02-03 00:39:57
Comment,2,glpa7vt,,0,1612275547.0,"There were EMTs on hand in the waiting area. If there were Epi-pens on site, they would’ve had them.",2021-02-02 16:19:07
Comment,1,glp9qga,,0,1612275202.0,"Ohhhhhhh, I did not know you were being so specific, I thought you initially said, “NO VACCINE IS FDA APPROVED!!!” Yet the first link I posted shows that there are 80+ approved vaccines. Wow I did not know tetanus and smallpox and polio were not approved. Are you saying the FDA is also lying about the approval of the Ebola Vaccine in this article: https://www.fda.gov/news-events/press-announcements/first-fda-approved-vaccine-prevention-ebola-virus-disease-marking-critical-milestone-public-health",2021-02-02 16:13:22
