title,score,id,url,comms_num,created,body,timestamp
Comment,1,gpn4k25,,0,1614885853.0,My dad got a bit of vertigo after his second one.,2021-03-04 21:24:13
Comment,1,gpn4ie1,,0,1614885813.0,"Getting my second dose today. I was supposed to get it tomorrow so I could ride the side effect wave over the weekend. Wallgreens called last night and said they don’t think they will have any stock come Friday as they haven’t received a shipment notification for it. They moved my appointment to today. So now I’m getting it today but I can’t miss work tomorrow. Crossing my fingers that I don’t get knocked on my as after it.


Update: got it yesterday around 2pm. It’s now 6am. A bit of a sore arm and a very very slight nasal drip.

10am. Skin is a bit sensitive

11am. A little tired.

1pm. All the above and a few aches but not terrible.

2:30. Chills and super sensitive

4pm everything is fine. Feel like I’m in the clear.",2021-03-04 21:23:33
Comment,1,gpmjb4a,,0,1614866619.0,Day 14: feeling good no side effects. One more week till my second dose. I will update after I get my next shot.,2021-03-04 16:03:39
Comment,1,gpmia64,,0,1614865857.0,"Got my first shot today, my shoulder hurts a bit but other than that everything is fine so far",2021-03-04 15:50:57
Comment,1,gpm4q7r,,0,1614857590.0,"Got my first shot today , still feeling total normal, no soreness. Didn’t even feel the injection. But worried reading all the comments here. Thanks for sharing !",2021-03-04 13:33:10
Comment,1,gpm3mif,,0,1614857017.0,"I’m about 6 days past my second dose. 

1st dose—a breeze! Just pain in the arm. 

2nd dose—Woke up with slight chills and body aches after receiving it the night before. As the day went on it got progressively worse. From about 11-630 I had really bad chills and body aches. It honestly felt like I had been in a car accident! It was very uncomfortable!! But as random as it came on, it also went away randomly! Around 630 I started feeling better. I slept about 9 hours that night and woke up the next day feeling fine! 

When I woke up I had barely any pain where I received the shot but I did have pain in my armpit for about 2 days! I checked and it said some people get pain there due to their lymph nodes!

That’s about it! I’m feeling fine now!!",2021-03-04 13:23:37
Comment,1,gpm2bd6,,0,1614856350.0,Got my first shot today around 11:30 am. It’s now 11 hours later. Had a nap this afternoon & my only symptom is a sore arm. Hopefully that’s it!,2021-03-04 13:12:30
Comment,1,gpm23ef,,0,1614856235.0,How are you feeling now? I’m also having a rough time,2021-03-04 13:10:35
Comment,1,gpm20ex,,0,1614856194.0,Same experience here. Going on day 6 and can’t get out of bed,2021-03-04 13:09:54
Comment,1,gpjzqun,,0,1614821232.0,Know who else is laughing all the way to the bank? Funeral homes. Hoping people will be too afraid to get the vaccine and the deaths keep piling up.,2021-03-04 03:27:12
Comment,1,gpjai7u,,0,1614810042.0,"Had my first dose on 23/2, within 15 minutes of having the jab I started feeling achey and heavy at injection site. I suffer with chronic migraine and have been getting mild attacks since the jab. 
By the next day I started feeling extremely fatigued, all over achey/muscle fatigue and chills. Over the next few days to add to this I started feeling waves of nausea, dizzy spells and mad itches on arms. 
I'm now on day 8 and still experiencing all of the side effects.
Tried to go into work today and was sent home within the hour, currently awaiting call back from GP as I'm also concerned now at how long this is lasting with no relief or sign of improvement.
Hope you feel better soon!",2021-03-04 00:20:42
Comment,1,gpj7sai,,0,1614808631.0,"Same!  Only other symptoms were sinus pressure and sore arm, but the arm was 90% better in 24 hours.  Crazy how the arm pain all but suddenly disappeared, it wasn’t gradual it was just suddenly not sore, which I wasn’t expecting",2021-03-03 23:57:11
Comment,1,gpifgqs,,0,1614785387.0,"I did too and thought it was something else. I had fatigue 5-8 days after the first shot, but no symptoms before other than a sore arm.",2021-03-03 17:29:47
Comment,1,gph69kt,,0,1614758713.0,Hi! I’ve also had delayed symptoms 8 days later and 3 negative tests. I have been having bad side effects for four days now... hoping it’s normal,2021-03-03 10:05:13
Comment,1,gpfplv1,,0,1614735187.0,That’s good to hear.  I had my first dose 6 days ago and I am still so exhausted/brain fog.  It’s like how I feel the morning after I pulled an all nighter for work.  Hoping it goes away soon (and doesn’t return after the second shot).,2021-03-03 03:33:07
Comment,1,gpfm0f2,,0,1614733617.0,"I got my first shot on 2/24, 6 days ago, and I am *exhausted*.  Thoroughly.  Even went and got tested for covid yesterday just to make sure and PCR came back negative.  Hoping this fatigue goes away soon.  Wondering if anyone else has experienced lingering fatigue.",2021-03-03 03:06:57
Comment,1,gpee7wz,,0,1614707093.0,You obviously are uneducated. Take the vaccine. Sign away your legal rights. Good luck,2021-03-02 19:44:53
Comment,1,gpe3wav,,0,1614697281.0,Update Day 11: Feeling good still no side effects and no fatigue.,2021-03-02 17:01:21
Comment,1,gpdov5p,,0,1614686842.0,"Got the vaccine on 2/18- sore arm, nausea, headache, and fatigue shortly after. 1 day later my arm was still sore and I started developing redness and a rash. By day 4 the redness went away. As of yesterday, the redness, rash, and tenderness came back. I’m slightly worried... has anyone else experienced this? I’m also still fatigued.",2021-03-02 14:07:22
Comment,1,gpdoomm,,0,1614686736.0,Three hours into my first shot. Only a small amount of pain in arm so far. I feel fine otherwise. I was quite nervous and had some anxiety right after injection but felt better in about 20 min. That’s not unusual for me and my history with anxiety. I will let you know how it progresses.,2021-03-02 14:05:36
Comment,1,gpdit92,,0,1614683492.0,"Got mine first dose yesterday, Feb 28. Will update as long as I have effects, and when I receive the second dose. 

For reference: I typically have a reaction to flu shots. In 2018, I ended up swelling, bruising, and getting a rash, whereas most years I only get minor swelling and ache, and maybe a slight immune response “like the flu”. To be fair, I typically also get colds around the same time, I tend to get sick the week in October the same week I schedule my vaccine. I have had some reactions (mostly the swelling) to medications/injections, so I was required to wait for 30 mins post injection. 

Day 1, immediately post dose: absolutely nothing, I barely even felt the needle. 

Day 1, up to 6 hours: if anything, just tired. I had a 2 hour ride to the site I went to, and 2 hours back. Both in the pouring rain, about 40°F. Didn’t eat til fairly late, and over ate at lunch. Could be many things. Ended up sleeping from 6pm until 9pm. 

Day 1, approx 8 hours post dose: arm started to get sore. This was about 10pm. Continued to get more sore overnight, ended up rolling onto arm while sleeping, which woke me up. 

Day 2: all day arm is pretty sore, sometimes for just pressure, sometimes it’s a constant sore. Guess depends on what I’m doing. Just spent approx. 2 hours meal prepping for the week, cutting veg and cooking, so it is a bit sore just from constant moving. It’s now 24 hours since soreness started (32 hours post dose) and I just took band aid off. No visible bruising/swelling etc.

Day 3: 48 hours later, soreness finally wore off. Small bruise, but no swelling. Let’s hope that’s the end of dose 1 side effects!",2021-03-02 13:11:32
Comment,1,gpddt13,,0,1614680805.0,"I received both doses as of 26th. The first dose was restricted to side effects of just pain at the injection site. I would rate it as moderate that lasted about 24 hours tops. Then all good. The second one had side effects very similar except far worse. My injection site was very sore that night (took my shot at 1:45PM). To the point that it kept me up late and I couldn't sleep on that side at all. I didn't take any pain meds just so I didn't reduce the efficacy. The next day the pain persisted, with redness and swelling and didn't reduce at all. I also had a small headache (less than moderate), just a small throb on and off. The following day, more of the same but with the shoulder pain reduced to moderate and below. Still a very small head throb every now and again. But now it is Mar 1st and I feel totally recovered. My shoulder feels the shot if I press against it but otherwise it is fine. Hope this is helpful.",2021-03-02 12:26:45
Comment,2,gpd5iuy,,0,1614676418.0,I'm on day 9 post injection and the headache behind my eyes is super mild but still noticeable. No fever though.,2021-03-02 11:13:38
Comment,2,gpd5a9c,,0,1614676290.0,"Today is day 9. I feel better but not 100% myself. I attempted to work out today and was super weak. 

Hang in there. We'll get through this!",2021-03-02 11:11:30
Comment,2,gpd22i7,,0,1614674550.0,I’m glad to see someone feeling symptoms a week later still like I am. Feels like everyone is over it in a few days and back to normal. I’m at say 6 and feeling so exhausted/run-down/headache behind my eyes like you! Good to know I’m not alone! Hope this passes for us soon!,2021-03-02 10:42:30
Comment,2,gpcx5vb,,0,1614671945.0,I (33/m) just got home from the hospital. Had the pfizer vaccine and well.... Hospital stay 4 days. Diagnosed with Transient global amnesia. Couldn’t walk or think or remember friday or saturday. Also had 3 MRis 2 ct scan. Lumbar punture. Some burning shot in my stomach. Labs 2 times a day and iv. Pretty fucked up.,2021-03-02 09:59:05
Comment,1,gpcj0ua,,0,1614664845.0,I came on Reddit to see if anyone had a similar experience and I’m relieved. I got my vaccine Friday morning and I just had arm pain for 2 days. Yesterday (Sunday) I just felt tired. Today I woke up just a little nauseous but as the day is going on I’m feeling more and more tired and a bit dizzy,2021-03-02 08:00:45
Comment,1,gpc6ty4,,0,1614659343.0,lol i know what thalidomide is,2021-03-02 06:29:03
Comment,3,gpc691c,,0,1614659089.0,"My husband (33/m) and I (30/f) received our first dose yesterday and we both experienced sore arms and he’s had no other side effects. I’ve experienced some dizziness and some anxiety, but that’s not unusual. Most of the elders in my family have received one or both doses with no major issues.",2021-03-02 06:24:49
Comment,1,gpc1quk,,0,1614657108.0,"30/f I got my first dose Sunday 
I had COVID in the beginning of January
So far have had off/on nausea",2021-03-02 05:51:48
Comment,1,gpbd42f,,0,1614646267.0,Saying that WWII was a long time ago is nothing anyone can object to.  It's a fact.,2021-03-02 02:51:07
Comment,1,gpbczwr,,0,1614646217.0,">So you trust the FDA to protect you from any adverse side effects or allergic reactions to a Covid vaccine that they have not approved?

There are side effects to every medication, so no, I don't expect them to protect me from those.  I do expect to not die gasping for breath like a fish out of water as a direct result of the vaccine, however.  This is how four of my friends died last year.",2021-03-02 02:50:17
Comment,1,gpb76jk,,0,1614643563.0,Most of the revenu’s will be earned in 2021. Pfizer is by far The most popular vaccine in Europa and most of the Europeans don’t want any other vaccine.,2021-03-02 02:06:03
Comment,1,gpau96g,,0,1614637187.0,Hmmmm WWII was not a million years ago. Some veterans would take serious offense at your lack of respect!!!,2021-03-02 00:19:47
Comment,1,gpatnsz,,0,1614636866.0,So you trust the FDA to protect you from any adverse side effects or allergic reactions to a Covid vaccine that they have not approved?  You are contradicting yourself...go for it.  Take the vaccine. Don’t bitch later if you have any adverse reactions because you can’t sue anyone. You are volunteering to take a drug that has NOT been approved for safety or efficacy by the same FDA you sit here and defend?!! Good luck,2021-03-02 00:14:26
Comment,1,gpat510,,0,1614636576.0,"They're all dead, because that happened a million years ago. I'm sure many of them died from not wearing seat belts, or from sleeping in asbestos sleeping bags - that's how long ago this was.

We understand drug safety and reproductive toxicology way better, now.  Safety standards have only gone up since the 50s.",2021-03-02 00:09:36
Comment,1,gpaskmi,,0,1614636253.0,"Well aren’t you smart? Tell that to all the women who had miscarriages, died or gave birth to children with severe deformities",2021-03-02 00:04:13
Comment,0,gpas2qd,,0,1614635977.0,"I never said it wasn't *tested* in the US.  I said it wasn't *approved* in the US.  This is absolutely true, and it's a major and deserved point of pride for the FDA.  You can't bring up thalidomide in the US as an example of how the drug safety apparatus failed.  That's an example of how the US FDA worked way way better than any other regulatory agency.  

Still true that the vaccine is saving lives....",2021-03-01 23:59:37
Comment,1,gpaqqql,,0,1614635207.0,"Contergean aka thalidomide was developed in 1956 and heavily marketed by the German pharmaceutical company that developed it. [Please see Chemie Grüehthal]. BioNtech is working in conjunction with Pfizer to produce several covid vaccines. Just because a drug isn’t produced by an American company doesn’t mean it won’t be made available to Americans under different names. (You ever heard of generic drugs?!) 

20,000 Americans, including pregnant women, were given thalidomide in “chemical trials” in the early 1960’s causing thousands of deaths and miscarriages along with babies born with malformed limbs. The pharmaceutical company that did this trial with thalidomide was an American company called Richardson-Merrill and Smith, Kline.  Sound familiar?  The side effects were not obvious immediately just as those aren’t for all these experimental covid vaccines.  When you volunteer to be in a clinical trial for a drug that is not proven safe or effective, you have no legal rights. 

Please be sure to read the fine print before you get a vaccine that has been FDA EUA for use only NOT for FDA APPROVAL and even FDA approval is suspect after President Obama signed legislation that pushes pharmaceutical drugs to market with less research requirements. 


Don’t expect to learn about the world from Wikipedia

Ask all our military men who watched Japan get nuked sitting in the decks of our war ships. “Cover your eyes 👀 “ over 80% died of cancer due to radiation poisoning. You are foolish.",2021-03-01 23:46:47
Comment,1,gpao52z,,0,1614633604.0,"No, you need to read the history. Thalidomide was not approved in the US, and the FDA avoided thousands of malformations.  From Wikipedia:

""The official in charge of the FDA review, Frances Oldham Kelsey, did not rely on information from the company, which did not include any test results. Richardson-Merrell was called on to perform tests and report the results. The company demanded approval six times, and was refused each time.""

Kelsey is held up inside the FDA as a saint.  There are portraits of her.",2021-03-01 23:20:04
Comment,1,gpanog3,,0,1614633307.0,Ya want to go into anaphylactic shock or suffer from Bell’s palsy or 🤔 what other side effects will show up in months or years after your allowed yourself to be injected with a drug that has not been approved for safety or efficacy by the FDA? Thalidomide caused thousands of deaths and miscarriages and limb deformities. It was marketed under a different name by the pharmaceutical companies but JFK sought legislation to add more oversight of the FDA because of that FDA approved drug prescribed as a sedative to pregnant women!!!,2021-03-01 23:15:07
Comment,2,gpakoz5,,0,1614631311.0,">Who told you that the mRNA vaccines are safer than getting covid? Pfizer?!! Moderna? AstraZeneca?!! Suddenly, you trust pharmaceutical companies making billions off gullible people?!! Purdue pharmaceutical company just got slapped with a $9 billion dollar fine and 3 criminal charges for lying to the public about opioid addiction!!! Bayer pharmaceutical company is also facing criminal charges. We have a world wide opioid epidemic that is caused by your trusted pharmaceutical companies!!!

Well I know four people who died from covid and one long hauler, and no one who has died from the vaccine. But also, I do trust that the data being reported on adverse effects are correct, which I gather you don't.  If you don't believe the data we get from the medical establishment, then how exactly the fuck do we know about all the opoid deaths?  According to your logic, those should all just be covered up, too. If we can trust the medical establishment to report on adverse events from opiods, then we can trust them to report on adverse events from vaccines. 

>Obama sighed legislation fast tracking drugs through the already overwhelmed FDA that have turned out to not be safe. Some carry black box warnings now. Many,‘ many drugs have been recalled for death and injuries. Ever hear of thalidomide?!!! Please look it up!!!

Thalidomide?  You mean the drug that the FDA actually rejected for safety reasons?  The system worked perfectly, in the states.  Even drugs with black box warnings are safer than smoking, obesity, excessive carbs, lack of exercise and drinking.",2021-03-01 22:41:51
Comment,1,gpagatm,,0,1614627853.0,"I’m sorry.  I hope that you feel better. I have chronic sinusitis and am highly allergic to almost all pharmaceutical drugs sooo, I have to be extremely careful. I’ve not gotten covid but don’t wear a mask unless requested. I won’t take a vaccine that isn’t FDA APPROVED because it may kill me. It may kill me even if it is approved. I’m very healthy but  I’m careful. I’m not stupid. Best I can do. I’m currently in Mexico to get away from the madness. You sound intelligent and you appear to understand you have a tough decision to make. I applaud you for making a decision based on facts. Good luck 👍🏼",2021-03-01 21:44:13
Comment,1,gpaevzi,,0,1614626605.0,"🤣 ok. See you in 6 months or a year or two. Please look up thalidomide!!! Look up Purdue pharmaceutical companies recent $9 billion dollar fine it just got slapped with and the 3 criminal charges is has for lying to the public about opioid addiction. Look up Bayer pharmaceutical company and the pending lawsuits regarding opioids and look up Monsanto while you are at it. Suddenly, everyone believes pharmaceutical companies are more interested in your health than profits?!! Please. Look up thalidomide!!  Do that at least.",2021-03-01 21:23:25
Comment,1,gpadm7m,,0,1614625425.0,"Who told you that the mRNA vaccines are safer than getting covid? Pfizer?!!  Moderna?  AstraZeneca?!!  Suddenly, you trust pharmaceutical companies making billions off gullible people?!! Purdue pharmaceutical company just got slapped with a $9 billion dollar fine and 3 criminal charges for lying to the public about opioid addiction!!! Bayer pharmaceutical company is also facing criminal charges. We have a world wide opioid epidemic that is caused by your trusted pharmaceutical companies!!! 

Obama sighed legislation fast tracking drugs through the already overwhelmed FDA that have turned out to not be safe.  Some carry black box warnings now. Many,‘ many drugs have been recalled for death and injuries. Ever hear of thalidomide?!!! Please look it up!!! 

If you are at high risk, obese, have type 2 diabetes, have high blood pressure and are just plain basically unhealthy, you certainly should consider a vaccine otherwise, the cdc states on THEIR website that MOST people recover from covid at home! .1% of the entire population of the USA has died of covid.  .1%!!!   We lose more people to health problems related to cigarettes but YOU think the government and pharmaceutical companies care how you die?  

Over 500,000 people die each year from cigarettes but “they” don’t care because “they” tax the hell out of cigarettes. If “they” cared, we’d all have affordable health care and cigarettes would be illegal. You have no one to sue if 6 months from now or 4 years you get ANY adverse side effects or allergic reactions to these covid vaccines because they are NOT FDA APPROVED!!! NO ONE IS LIABLE FOR ANY ADVERSE SIDE EFFECTS OR ALLERGIC REACTIONS TO ANY COVID VACCINE!! Authorization is not FDA approved!!! 

If covid could be taxed, our doors would fly open!!! It’s about money!!!  Good luck 👍🏼",2021-03-01 21:03:45
Comment,1,gp9neia,,0,1614602500.0,"I got my first dose on Saturday. My arm is really sore, and I had lower energy than normal today with dull aches all over, but I generally feel fine. I know that the 2nd dose is likely to be worse. I have MS, and I have to give myself interferon injections every week. Those cause the flu-like symptoms, which are pretty well managed with ibuprofen, and this doesn’t feel as bad as when I forget to take ibuprofen.",2021-03-01 14:41:40
Comment,1,gp8wybx,,0,1614587101.0,M super scared to get my second dose on Tuesday for this reason. I’m afraid it will be waaay worse than first one and my first one I had a migraine for 2.5 weeks.,2021-03-01 10:25:01
Comment,1,gp8uz8y,,0,1614586008.0,"I got my second Pfizer dose yesterday.  Very bad headache, sore arm pain to the point of numb, abdominal pain and low grade  fever. I had chills throughout the night and early morning.  I had side effects after the first dose but not to this extent.",2021-03-01 10:06:48
Comment,2,gp8sdpk,,0,1614584650.0,"It was approved for both under an EUA. It is certainly safer than contracting covid, which is all that matters.  It does reduce your chance of getting covid by 90 - 95%.  If you do get it, you are 100% protected against winding up in the hospital.  All vaccines are lawsuit proof; otherwise pharma would not be able to make them.",2021-03-01 09:44:10
Comment,2,gp7seb8,,0,1614570960.0,"Got my 1st shot Tuesday 2/23 and didn’t start feeling symptoms until 24 hours later. Exhaustion, headache, achy all over. Went away in the evening then came back 48 hours later. Its been on and off aches/exhaustion. Today is day 5 and I still have a headache behind my eyes that won’t seem to go away. That’s the biggest thing that’s bothering me is this never ending headache behind my eyes. 

Anyone else have a lasting headache from this?? I just want to be able to move my eyes around without pain lol",2021-03-01 05:56:00
Comment,1,gp5o1hk,,0,1614536339.0,I had a slight sore throat too. But to the 3rd day I'm completely fine,2021-02-28 20:18:59
Comment,1,gp4wwbs,,0,1614523210.0,I was so nervous before the shot my heart rate was 175! My friend is a nurse and almost came over with a beta blocker...,2021-02-28 16:40:10
Comment,1,gp4qaqy,,0,1614520447.0,Update Day 9: Feeling good still. No side effects to report. Will try to report back in a few days just to keep you all who might be interested up to date.,2021-02-28 15:54:07
Comment,3,gp31igz,,0,1614490894.0,"I was told not to take ibuprofen (Advil) but Acetaminophen (Tylenol) was ok if I needed it. I was mortified because I’d taken Advil for my menstrual cycle 8 hours before the first shot. 

I was fortunate to not have any symptoms other than soreness at injection site with both shots. I’m 8 days out from the second dose (2/19).",2021-02-28 07:41:34
Comment,1,gp2uxsc,,0,1614488872.0,"Been experiencing similar symptoms to what I've been reading here, which makes me feel a bit better today since I'm not alone in this. A little background on me: I'm 38 (m) non smoker, extremely active run/workout 5/6 days a week, fairly healthy balanced diet, no known prexisting conditions. 

Got my first dose of Pfizer on Saturday (2/20). No immediate effects noticed. 

Day 1 - Sunday: Arm soreness, nothing else 

Day 2 - Monday: I feel fine, back to normal. Arm soreness gone. Was able to workout without a problem.

Day 3 - Tuesday: Tuesday evening began to develop a fever. Had chills and cold sweats. Fever went to 102 F.

Day 4 - Wednesday: Fever was up and down, started to develop a sore throat, minor congestion. At this point I was convinced that I caught Covid based on symptoms and went and got tested. Had very low energy and continued to sleep throughout most of the day. 

Day 5 - Thursday: No fever today, but still very lethargic and low energy. Sore throat persists. Results from Covid test came back negative. 

Day 6 - Friday: My body still feels run down. Attempted to workout. It was a struggle and felt like I was working out hungover. Also developed a headache which seemed to be concentrated behind my eyes. Low grade fever (99F) and still super tired. Sore throat isn't as bad as the day before.

Day 7 - Saturday: Slept 13 hours and headache still persists. Sore throat seems to be gone but I'm still low energy and running a low fever (99F). Have not moved from bed. 

I'm thankful to have the vaccine but coincidentally had a week off from work. I couldn't imagine going to work and being productive with these symptoms. If the second dose is allegedly worse, I do not look forward to it. 

Side note: I have been reporting my symptoms to the daily V-safe texts that I get from the CDC.",2021-02-28 07:07:52
Comment,1,gp2ad8h,,0,1614483400.0,I got mine today about three and a half hours ago. On my drive home I started feeling really tired. As soon as I got home I took a nap and actually just woke up and decided to see if fatigue and exhaustion/nausea was a common symptom. Thanks for this thread for putting my mind at ease,2021-02-28 05:36:40
