title,score,id,url,comms_num,created,body,timestamp
Comment,1,gp14j4m,,0,1614471873.0,"I also had nausea and tightness in my throat on the second day. Fortunately, the side effects are mostly gone now. I too am dreading the 2nd vaccine.",2021-02-28 02:24:33
Comment,1,gp07dub,,0,1614463599.0,"same. i got mine thursday (2/25) and i've been extremely tired. i slept for nearly 12 hours last night, which is crazy for me. my headaches come and go. i am not looking forward to the symptoms of the 2nd vaccine",2021-02-28 00:06:39
Comment,1,gp0136x,,0,1614462174.0,"Nothing to report, fortunately!! Other than slight soreness at injection site, which went away after 24 hours, I’ve not had any reaction at all. 

Feels great to be 8 days out and fully vaccinated.",2021-02-27 23:42:54
Comment,1,goxn3ke,,0,1614424930.0,glad to hear it! my better half got her first pfizer shot today so i was a little worried. thanks for responding!,2021-02-27 13:22:10
Comment,1,goxhnuy,,0,1614423093.0,Totally fine! My second shot I had 0 side effects :),2021-02-27 12:51:33
Comment,2,goxdzaa,,0,1614421359.0,12-14 days until ~50% immunity.,2021-02-27 12:22:39
Comment,2,gowu4a2,,0,1614412314.0,"The pulsative tinnitus is gone, now it's just dizziness and nausea and maybe a two second headache at some random point in the day.",2021-02-27 09:51:54
Comment,1,gows1gk,,0,1614411650.0,Do you still have it? I have headaches and pulsative tinnitus.,2021-02-27 09:40:50
Comment,2,gowqu3y,,0,1614411264.0,That’s exactly what happened to me. Went away two days before and then I got my second shot and came back 3 days after the 2nd shot.,2021-02-27 09:34:24
Comment,1,gowqnmi,,0,1614411206.0,Let us know what they say! I had the same and they couldn’t find anything wrong.,2021-02-27 09:33:26
Comment,2,gowq9xq,,0,1614411076.0,"I had severe bouts of vertigo after the first shot and then headaches that last for 10 days. The after the second shot I had the same but slight dizziness and headaches. Now 12 days out and still have them. I feel the same way. I told my husband I just want to sit and cry because it’s not getting better. I had a CT scan and a hearing test and bloodwork done. Nothing came up. Scheduled for vestibular testing, allergy testing and an MRI. Oh and I’ve had pulsative tinnitus and heart palpitations also but with a normal pulse rate.",2021-02-27 09:31:16
Comment,1,gowoy4l,,0,1614410652.0,"Same boat. I’ve seen 4 teledocs, 2 ER docs and an ENT. No one can find anything wrong but I have headaches with dizziness and tinnitus. It’s been going on now for 12 days.",2021-02-27 09:24:12
Comment,2,gowof55,,0,1614410480.0,I wonder how much of that is true for me. I think the placebo effect is causing me anxiety which is causing me to have high BP and causing headaches.,2021-02-27 09:21:20
Comment,1,gowo81h,,0,1614410417.0,I felt headaches and dizziness for about 10 days after the first shot. It finally went away and so I got the second shot. It’s been 12 days since the second shots symptoms started (same ones) and they haven’t gone away yet. Had a CT scan and tests at an ENT. Nothing found yet. Except my anxiety is through the roof which in turn has increased my BP which is usually perfect.,2021-02-27 09:20:17
Comment,1,gowmi19,,0,1614409872.0,most people experience no side effects from the vaccine lmao,2021-02-27 09:11:12
Comment,2,gowc76p,,0,1614406623.0,how do you feel now?,2021-02-27 08:17:03
Comment,1,govlujf,,0,1614398863.0,"Well, had my second dose last night. Today I’m feeling pretty bad. No fever but the body aches are the worst. There is no comfort!! I have chills too. Ughhhh. I’m thankful to have gotten it though but I’m feeling pretty miserable.",2021-02-27 06:07:43
Comment,2,govjfdn,,0,1614398172.0,"You know, you are right that most people do recover from covid. But they suffer long term effects which are known as long haulers. I really prefer the vaccine over a virus that gives you long term effects. I had covid and recovered only had mild symptoms but I now suffer effects from the virus, one which is I can no longer smell or taste. I always had problems with my sinuses, I would get sick every year but never had long term effects like covid did to me. So Mr. Square person who likes the supermarkets, yes vaccine isn't approved and yes it can kill but so do all other APPROVED vaccines can kill too. If the person knows he/she has had problems with vaccines before, or has many allergies well is better not to get vaccinated. If you don't want to get vaccinated that is your personal choice, but others like me do want to get a vaccine to help us prevent the virus. And you know what the flu vaccine is usually always 60% and below in efficiency and it is approved by FDA every year.",2021-02-27 05:56:12
Comment,1,govff2r,,0,1614397030.0,"As in 12% efficiency? Or 12 weeks apart for shots?

My next one was meant to be April but it’s been brought forward to March 10th for some reason",2021-02-27 05:37:10
Comment,1,gov84gs,,0,1614394928.0,Update: it’s 12,2021-02-27 05:02:08
Comment,1,gou2wlb,,0,1614380633.0,24 days later.. how are you?,2021-02-27 01:03:53
Comment,1,gotg8vk,,0,1614366795.0,"I’ve had both injections, my second on Monday (today is Friday for those reading this at a later date). I’m a teacher who has been in-person since August with underlying health conditions, so any complaints I have take a backseat to the protection it affords.

First injection: got it in the afternoon with no initial symptoms other than some fatigue later that evening. The next morning I woke up and felt like I had fallen on a doorknob with the shoulder that received the shot, which is an atypical reaction for me when receiving vaccinations. I did my usual activities, including some light tree pruning, cursing my arm because it hurt but it didn’t hinder my activities greatly. The next morning that pain was gone and I had no other symptoms.

Second injection: noticed swollen lymph nodes under the injection arm that are sensitive to the touch. I may be running a slight temperature or I may be overheating easier. I’ve had some mental health issues: increased anxiety and mood swings. My physiology is particularly sensitive to vaccines and medications in general (I don’t know why, my psychiatrist doesn’t know why—just lucky, I guess /s). It’s nothing I can’t recognize and deal with, since I’ve gotten used to living in this body with its many quirks. The random anxiety I have been experiencing is nothing compared to the panic I felt back in March when no one knew what the hell was going on.

10/10 would do it again.",2021-02-26 21:13:15
Comment,1,gori3k9,,0,1614321775.0,1st day after vaccine and I have extreme fatigue and headache.,2021-02-26 08:42:55
Comment,1,gor848m,,0,1614317408.0,Im doing good,2021-02-26 07:30:08
Comment,1,gor80te,,0,1614317369.0,Just got my second jab a few moments ago. Will update with symptoms later.,2021-02-26 07:29:29
Comment,1,gor7yhk,,0,1614317342.0,How are you doing? Just got my second one a few minutes ago!! I’ll update how I’m feeling later,2021-02-26 07:29:02
Comment,1,goqyxc0,,0,1614313679.0,"Hello, the next two days after my second pfizer dose (end of January) I broke out in itchy acne on my face and under my chin, this has lasted for weeks  really itchy and easily irritated by mask, face washing ect...I hadn't changed my skincare routine at all.  It seems to be fungal acne (Malassezia folliculitis). Has anyone else had this type of reaction ?",2021-02-26 06:27:59
Comment,1,goqxuzf,,0,1614313243.0,"Hi all,  sorry if this question sounds weird but I’m serious. 

I had my first dose yesterday, like most of you - sore at the arm and feeling fatigued / brain foggy today on day 2. 

With a year long lockdowns and living alone I’ve taken up to enjoying a moderate amount of beer every evening while watching a new movie. 

Has anyone had any side effects/complications of consuming beer / alcohol after the first dose?

Thanks and stay safe!",2021-02-26 06:20:43
Comment,2,goqmaug,,0,1614308632.0,"I am 13 days out from first Pfizer shot. No real issues until about day 7, then started this persistent daily headache. I can’t get rid of it, tylenol etc does nothing. Since I do NOT have Covid it must be a reaction to antibodies but I can’t do my usual things with this pain. In researching Covid related headaches there are some NIH articles you can find, OTC things to reduce inflammation and even allergic-type response. I am hoping this headache stops soon— probably right before my second shot.",2021-02-26 05:03:52
Comment,2,goqio54,,0,1614307343.0,"I am a 26 year old female and I am able to get the vaccine now, I have no underlying health conditions, but I’m nervous about it since it’s so new. I don’t have kids but I would like some in the future. I am afraid that maybe this could affect them or me long term. 
Please share your thoughts or research you may have made. 
Sorry I tried to post the question but it said I wasn’t a trusted member",2021-02-26 04:42:23
Comment,2,goq120f,,0,1614300414.0,You just made a good point. There is no cure for the flu or covid. I stopped getting the flu vaccine years ago and I stopped getting the flu. Good luck to you,2021-02-26 02:46:54
Comment,1,goq01ht,,0,1614299987.0,"I assume you know how to navigate google for the FDA or CDC WEBSITEs.  It’s common knowledge.  Not one Covid vaccine is FDA approved. Authorization by the government is not approval by the FDA for safety or efficacy. If you get any covid vaccine, please read the legal information about your inability to sue anyone for anything related to the vaccines. You can’t. If you develop ANY adverse side effects or allergic reactions, you will be required to assume all responsibilities for your medical treatment and care. I am not taking any vaccine made by a pharmaceutical company that has zero liability for its drug. I’m also not taking a vaccine for a virus that most people recover from. [See: CDC WEBSITE]",2021-02-26 02:39:47
Comment,2,gopnoeh,,0,1614294657.0,keep us posted if it clears up or not. thanks,2021-02-26 01:10:57
Comment,1,goolnjx,,0,1614267660.0,"it’s been over 48 hours and i am still in so much pain, i wasn’t expecting this being pretty young. has anyone else experienced this? i just keep taking pain killers and hoping for the best because it’s making me really spacey and hot feeling

edit: second dose",2021-02-25 17:41:00
Comment,1,gooez6m,,0,1614262339.0,😂😂😂😂,2021-02-25 16:12:19
Comment,1,gooej76,,0,1614262019.0,How’s it going,2021-02-25 16:06:59
Comment,3,goo6rty,,0,1614256963.0,The flu shot isn't a cure and people still get it so i don't understand the point you're trying to make here.,2021-02-25 14:42:43
Comment,1,gont0z3,,0,1614249851.0,I had bad fatigue and brain fog after my first dose too. Almost threw up at work and had bad diarrhea as well.,2021-02-25 12:44:11
Comment,1,gokelu3,,0,1614188194.0,"First day I got the shot I was cool got home that same day passed out for almost 6 hours. Next day woke with a sore arm. Fell asleep for almost half the day. 3rd day I actually did have some labored breathing. 4th day I feel great. 5th day still good. 6th still breathing, but I do have a sudden urge for brains. Jk but still good.",2021-02-24 19:36:34
Comment,1,gojtll3,,0,1614171024.0,"Hi, I just had my vaccine today and I am starting to feel chest pains and shortness of breath. I really think it’s another side effect, I don’t usually have chest pains.",2021-02-24 14:50:24
Comment,1,gojrzbp,,0,1614170050.0,Just got the shot today - just a sore arm and slight fatigue (barely noticeable). Otherwise nothing significant.,2021-02-24 14:34:10
Comment,1,gojgvmn,,0,1614164010.0,What happened after you received the 2nd dose?,2021-02-24 12:53:30
Comment,1,gohur12,,0,1614137022.0,"My sore throat lasted for like two days (2nd and 3rd after vaccination), stopped one day, and then came back for another day. 

It wasn’t bad any of the days, just felt like I had a sore throat building up.",2021-02-24 05:23:42
Comment,1,gohtxix,,0,1614136664.0,"I had my vaccine on Friday and have a sore throat. As you say, not a listed side effect but good to know someone else has had this",2021-02-24 05:17:44
Comment,2,gog77oj,,0,1614108356.0,"I had that pressure in my left ear the other night. Bad ringing in ears, too. I could barely hear out of that ear either. Thankfully it cleared up by morning! I have an appt with ENT on Friday.",2021-02-23 21:25:56
Comment,2,gofq3ar,,0,1614092731.0,"I'm four days out from my second shot and I have severe dizziness. On Sunday I had a pulse like pressure in my left ear as well as dizziness. On Monday, it is just dizziness but far worse than on Sunday. It's one in the morning now so I'll see what Tuesday has in store for me.",2021-02-23 17:05:31
Comment,1,gof2cli,,0,1614078139.0,"I wanted to note: throughout my life, whenever I get a cold, I get hit hard. In cases when my husband would get the same virus, I would be in bed for days while he would be fine with sniffles. I wonder if my immune system is very reactive in general.",2021-02-23 13:02:19
Comment,1,gof1v5v,,0,1614077890.0,"A quick update! On Sunday (4 days after my first vaccine) my symptoms (fatigue) alleviated. Feeling good now!! Looking forward to my next vaccine, but aware the symptoms might be uncomfortable. So thankful for this vaccine!",2021-02-23 12:58:10
Comment,1,goeltxy,,0,1614069904.0,"> “The vaccine”? There are several vaccines and yes there are deaths linked to the Pfizer vaccine.

Yes, there are multiple vaccines, I just didn't realize I needed to actually specify to you which vaccine when posting in /r/PfizerVaccine.  But sorry, I'll take the word of the CDC who I quoted above over some rando on the internet whose response is ""yes there are"" without and documentation.",2021-02-23 10:45:04
Comment,2,godlikk,,0,1614053016.0,"I have!!! I just came to Reddit to see if others were experiencing the same thing. I received my shot on February 4th and only had the arm pain for about 2-3 days. Then I started to have symptoms around the 9th and 10th. The symptoms consisted of very bad migraines, nausea, and tiredness. I have been getting motion sick from riding in the car and on plane rides which I have never had happen before. My symptoms are still here 18 days after the first dose and 13 days after symptom onset. At this point I’m started to get scared it won’t go away and don’t know what to do. It is making life miserable for me. 😔",2021-02-23 06:03:36
Comment,2,godkmoz,,0,1614052624.0,"Same here. I am really started to regret it and now I don’t know if I want to get the 2nd shot. I received my shot on February 4th and only had the arm pain for about 2-3 days. Then I started to have symptoms around the 9th and 10th. The symptoms consisted of very bad migraines, nausea, and tiredness. I have been getting motion sick from riding in the car and on plane rides which I have never had happen before. My symptoms are still here 18 days after the first dose and 13 days after symptom onset. At this point I’m started to get scared it won’t go away and don’t know what to do. It is making life miserable for me. 😔",2021-02-23 05:57:04
Comment,2,godkcpv,,0,1614052504.0,"I also had a delayed reaction to the 1st shot. Delayed about 6 days later. Very bad migraines, tiredness, and nausea.",2021-02-23 05:55:04
Comment,1,godj3ds,,0,1614051952.0,"I just came to Reddit to see if others were experiencing the same thing. I received my shot on February 4th and only had the arm pain for about 2-3 days. Then I started to have symptoms around the 9th and 10th. The symptoms consisted of very bad migraines, nausea, and tiredness. I have been getting motion sick from riding in the car and on plane rides which I have never had happen before. My symptoms are still here 18 days after the first dose and 13 days after symptom onset. At this point I’m started to get scared it won’t go away and don’t know what to do. It is making life miserable for me. 😔",2021-02-23 05:45:52
Comment,1,gocqr63,,0,1614039828.0,"What does shutting down the economy and locking people in their homes have to do with this conversation?  

You implied repeatedly that the vaccine is unsafe and is killing people.  I pointed to the CDC data which says there have been no deaths linked to the vaccine.  Your comment is nothing but a red herring.",2021-02-23 02:23:48
Comment,1,gobc2ma,,0,1614004050.0,Update Day 4: feeling normal. Nothing I would say particularly feels bad or like a side effect. Still not out of the woods yet so I’ll update when I remember. Hope everyone is feeling ok.,2021-02-22 16:27:30
Comment,2,goawjo8,,0,1613993913.0,"I just came to Reddit to see if others were experiencing the same thing. I received my shot on February 4th and only had the arm pain for about 2-3 days. Then I started to have symptoms around the 9th and 10th. The symptoms consisted of very bad migraines, nausea, and tiredness. I have been getting motion sick from riding in the car and on plane rides which I have never had happen before. My symptoms are still here 17 days after the first dose and 12 days after symptom onset. At this point I’m started to get scared it won’t go away and don’t know what to do. It is making life miserable for me. 😔",2021-02-22 13:38:33
Comment,1,goa8zqq,,0,1613981512.0,Happy to help! Glad you got signed up. The first several days they should text with a link to check in every day. Then I think it was the second week that it transitions to a weekly check in. Hope you’re able to get some rest and it all subsides with no further issue 🤞🏻,2021-02-22 10:11:52
Comment,1,goa8ld1,,0,1613981298.0,"Thanks for telling me about this, I hadn't heard of it. I got my vaccine at a church, I got a vaccine card and a stick, no handouts. I did just sign up.",2021-02-22 10:08:18
Comment,1,go9z827,,0,1613976487.0,"Did you sign up for the V-Safe after vaccine check ins with the CDC? Your vaccine provider should have given you a handout or had you sign up at the time of vaccine. If so, they may contact you if you are having uncommon or previously unseen side effects. You may want to go ahead and contact your primary care doctor tomorrow if you are still having concerning issues.",2021-02-22 08:48:07
Comment,1,go9y8mk,,0,1613975984.0,"I got my second dose on Friday. Saturday I felt like I had low blood sugar all day. I finally felt normal in the evening after eating a small single serving bag of Annie's gummy bunnies. Today, Sunday, I have dizziness and pulsing in my left ear. The injection site isn't sore and I haven't experienced any body aches. I haven't read about these symptoms.",2021-02-22 08:39:44
Comment,1,go9g83q,,0,1613967330.0,Tysm!,2021-02-22 06:15:30
Comment,1,go97py4,,0,1613963716.0,"Oh my gosh, 5 days is a long time to have persisting symptoms! I hope you feel better soon, but it's also nice to know I'm now the only one who had delayed symptoms. If it helps to know, I had my second vaccine on Feb 11th and aside from having the typical sore arm for a day from the injection I have had zero symptoms since! I hope you have the same experience!",2021-02-22 05:15:16
Comment,1,go8pslo,,0,1613955690.0,So happy to hear someone had a similar experience though I'm sorry you felt ill! I also had delayed symptoms to 3-5 days after and they're still here now 10 days after first dose/5 days after symptom onset,2021-02-22 03:01:30
Comment,1,go74d4z,,0,1613912868.0,"https://www.cdc.gov/coronavirus/2019-ncov/vaccines/safety/adverse-events.html

> Over 52 million doses of COVID-19 vaccines were administered in the United States from December 14, 2020, through February 14, 2021. During this time, VAERS received 934 reports of death* (0.0018%) among people who received a COVID-19 vaccine. CDC and FDA physicians review each case report of death as soon as notified and CDC requests medical records to further assess reports. A review of available clinical information including death certificates, autopsy, and medical records findings revealed no link with vaccination. CDC and FDA will continue to investigate reports of adverse events, including deaths, reported to VAERS.

To put that in perspective, .15% (over 1 out of 1000 people) of the US population has died from COVID.",2021-02-21 15:07:48
Comment,2,go6seq0,,0,1613905697.0,"Your field is in genetic technology, yes? Please explain to all of us how the mRNA vaccines work and the potential damage it can cause. Also, please refrain from calling a virus ""dead"" like you did in a different comment, viruses are not alive to begin with. It's a little strange that you completed a STEM bachelor's degree and still do not know this.",2021-02-21 13:08:17
Comment,1,go59j5w,,0,1613876415.0,"Got my first vaccine two days ago, didn’t feel anything immediately after. Next morning I had a sore arm and was very sleepy. Spent the whole day feeling groggy, woke up today feeling the same. Feels like I’m fighting off a small cold, little cough and a slight ache all over. Nothing major. Overall seems on par with others experiences. Will update after round 2.",2021-02-21 05:00:15
Comment,2,go4byfm,,0,1613858816.0,"5 days after my first Pfizer vaccine I started getting small waves of dizziness. 3 days after that they became severe and the vomiting started. It was so bad I could not even stand up and could not stop throwing up. Husband actually had to call 911! Was admitted and given fluids and anti nausea. I could not even open my eyes forv2 days without throwing up. Cat scan. MRI, blood work all ok. 
Dr said could very well be vertigo brought on by vaccine even though no live virus in vaccine your body doesn't know that. There is a viral type of vertigo. 
Went for second vaccine since doc said better than getting covid. I actually had two days feeling better after 2nd shot but now back to waves of dizziness but thankfully no nausea. 
Some episodes put me in bed, bad ringing in ears and feeling like crap. Tinnitus is constant but gets worse with bad dizzy spells. 
Doc prescribed Meclizine but it makes me feel worse and does nothing for dizziness.
It's been a month of this now! Very difficult to work. Can't even walk the dog! I spend most of my day working in bed on my laptop. I just try to cram everything I need to do in between waves. I'm pretty tough and have been fighting through but it is really getting hard not to cry! To top it all off, I am also packing the house to move next week 18 hrs away! Can't even drive so hubby will have to take full brunt. 
Anyone else having this severe dizziness? How long did it last?",2021-02-21 00:06:56
Comment,1,go3bok6,,0,1613827657.0,"First dose - Jan 29

Nothing immediately after. Soreness at injection site 6 hours later. Went away after 24 hours.

Second dose - Today (Feb 19)

Nothing immediately after. I have some soreness at injection site but less so than before. The flu shot hurt worse.

Hoping that this continues!",2021-02-20 15:27:37
Comment,1,go37pz1,,0,1613825128.0,Update Day 2: my arm is a little sore but actually not as sore as when I got my flu shot back in October. So far I can say I haven’t felt anything that I would classify as side effects or feeling ill. I will update tomorrow if I remember.,2021-02-20 14:45:28
Comment,1,go2z0pl,,0,1613820201.0,"35/F — First dose two days ago, 2/17. About 6 hours after the vaccine I started getting a sore arm/neck close to the vaccine site. My face felt flushed but I didn’t have a fever. I began to feel run down (like I do when I have a cold) and went to bed early. Arm was sore through the night. 24 hours after vaccine the arm was less sore but still with moderate fatigue. Took some ibuprofen and felt better. Also very thirsty! 48 hours after, arm soreness and fatigue went away. However, about 55 hours after I began to feel fatigue and face flushing again. I am going to make it another early night to see if I can sleep it off! The side effects make me remember that my immune system is equipping itself to fight COVID. Grateful for the vaccine! Will report back on 2nd shot side effects.",2021-02-20 13:23:21
Comment,5,go2se22,,0,1613816648.0,Soreness was gone by Friday. I got a tiny bit sleepy Friday afternoon and just a little bit of an upset stomach but nothing major at all. I’m scheduled to get the second dose Friday the 26th in the morning. I was able to make a Friday appt for the second shot because my primary physician warned me that most likely I’ll have some side effects from the second one. If that happens I’ll have the weekend to rest. Will report back after I get the second one.,2021-02-20 12:24:08
Comment,2,go2etdr,,0,1613809523.0,Good!,2021-02-20 10:25:23
Comment,2,go2eoh7,,0,1613809454.0,Will do!! I’m a bit nervous for that one but a few people that I know had basically no symptoms except a sore arm. 🤞🏻🤞🏻,2021-02-20 10:24:14
Comment,2,go2e5ip,,0,1613809183.0,Congrats Im glad it went well please keep me updated I will get my second one on March 12th,2021-02-20 10:19:43
Comment,1,go2dc03,,0,1613808760.0,I was very thirsty too after mine!,2021-02-20 10:12:40
Comment,3,go2cxl1,,0,1613808552.0,Totally fine! My arm was slightly sore (like a flu shot) but I didn’t have to take any medicine or anything. I go for my second shot on the 25th!,2021-02-20 10:09:12
Comment,1,go2ck02,,0,1613808354.0,How are you now? I had my first injection this morning,2021-02-20 10:05:54
Comment,1,go2chpu,,0,1613808320.0,Any other symptoms or this was all and you recovered?,2021-02-20 10:05:20
Comment,1,go2c5l3,,0,1613808145.0,I just received the vaccine today at 9am and no side effects at all until 8 hours later a sore arm.,2021-02-20 10:02:25
Comment,1,go26f8n,,0,1613805207.0,Got my 1st shot 6 hours ago. My arm is starting to feel sore and I have been EXTREMELY THIRSTY so far that is it,2021-02-20 09:13:27
