title,score,id,url,comms_num,created,body,timestamp
Post Pfizer Vaccine Experience,33,lam09i,https://www.reddit.com/r/PfizerVaccine/comments/lam09i/post_pfizer_vaccine_experience/,164,1612264324.0,"Hey guys,
I received the Pfizer Vaccine (only the first dose so far) and am looking for others to share experiences, mainly experience a week after the shot as well as related to physical activity and working out.
I did feel a little soreness in the shoulder the day after but felt overall alright. However it's been over a week now and I feel generally more tired at all times, especially at the gym. I am a hobby bodybuilder and am In the sport for 5 years now. Ever since I received the vaccine, I feel like my workouts have been short, way more exhausting and weaker. Has anyone else experienced this?",2021-02-02 13:12:04
Boast,2,laisya,https://www.reddit.com/r/PfizerVaccine/comments/laisya/boast/,1,1612254601.0,Is Pfizer going to blow up like GameStop?,2021-02-02 10:30:01
NO VACCINE IS FDA APPROVED!!! You can’t sue ANYONE if you have adverse side effects or allergic reactions. Ask the 43 families who lost loved ones in Norway!!! AUTHORIZATION is not FDA APPROVED!!!,0,la5jlp,https://www.reddit.com/r/PfizerVaccine/comments/la5jlp/no_vaccine_is_fda_approved_you_cant_sue_anyone_if/,17,1612221852.0,,2021-02-02 01:24:12
How long can you delay getting second dose?,9,la24nc,https://www.reddit.com/r/PfizerVaccine/comments/la24nc/how_long_can_you_delay_getting_second_dose/,12,1612211868.0,"I am supposed to go back and get my second dose today, but I am scheduled to have surgery this week and I am expecting to have a pretty bad reaction to the vaccine dose (I felt terrible for a few days with the first dose, and everyone has told me second dose will likely feel worse).
Does anyone know how long I can wait before going back for my second dose? If I can wait 2 more weeks I’ll have healed a bit from surgery and can use my down time off work to get through it. It has already been 3 weeks since my first shot.",2021-02-01 22:37:48
Pfizer-BioNTech Vaccine Obsevations,11,l96w0h,https://www.reddit.com/r/PfizerVaccine/comments/l96w0h/pfizerbiontech_vaccine_obsevations/,20,1612104893.0,"I (44/M) was inoculated around 6:45 in the evening on Wednesday, Jan. 27 with the Pfizer-BioNTech Vaccine. I received the vaccine at a mass inoculation site at our local Expo Center. I am technically part of the 1b group, but was able to get the shot at the tail end of the 1a group, due to some wrangling by my employer.

I experienced some dizziness and splitting headache about 10 minutes after the injection (in right deltoid) and mild pain at injection site, while I was waiting in the 15 minute observation waiting area after the shot was given. On the 28th, I felt some nausea and dizziness again about 14 hours later and another bad headache. The nausea and dizziness dissipated shortly and the headache later in the afternoon. The injection site was slightly more painful. On Friday, 29th and Saturday, 30th, basically no symptoms. Counting my blessings.

Why I choose to get shot?

1) Health Concerns. I have some underlying conditions (Asthma, Hypertension and a few others).

2) Opportunity. I put my name in early with employer, got the call, drove to the site.

3) Research. If you read the trial data on the vaccine BNT162b2 it was 95% effective against COVID-19, 7 days after the 2nd dose: https://www.nejm.org/doi/pdf/10.1056/NEJMoa2034577?articleTools=true

What makes me apprehensive about this shot?

1) We do not know the long term side effects of the vaccine. Should I wait until this is determined?

2) Rabies, Influenza, Cytomegalovirus, and Zika have all had vaccines created with mRNA (all of which I have not had), yet the #1 (Pfizer-BioNTech) and #2 (modeRNA) vaccines use this new delivery system of mRNA for vaccination. Is mRNA truly safe for humans? 

3) The trial lasted 111 days (July 27 to Nov 14, 2020), so does that mean the vaccine was created in 4 months 17 days (139 days) minus the initial testing on humans, if you use the day of March 11 the World Health Organization (WHO) declared this a pandemic? My memory tells me Dr. Anthony Fauci on many press conferences, said it would take a year to a year and a half to create a vaccine, yet Pfizer-BioNTech did it just under 5 months and also created a vaccine with a 95% efficacy. It almost seems to good to be true? 

4) LNP (Lipid Nanoparticles) is such a new technology in medicine, relatively speaking, it is also worrisome the effects this will have on our bodies with this vaccine?

5) Why is there such a heavy push to get vaccinated by the media and political affiliations? And why all of a sudden IS THIS vaccine free to anyone, but other vaccines are not? Who is paying for all of this?

6) If I wait until the summer when it is rolled out, will there still be enough available? Will there be a syringe shortage, as some are talking about? Will there be some other issue that arises, that I will not be able to get the shot, when the opportunity to get it is now?

Finally, some observations about the evening I received my shot:

1) There were some 40 booths set up, one after the other at my site, giving out the vaccines. It was not very private or HIPPA regulated, as one would normally see in a hospital setting and maybe this is because the government (ie. tax payer) is on the hook for the shots and privacy is not a concerned.

2) The nurse giving me the shot was (to my understanding) not a licensed nurse but a student nurse from the local university...not sure if this matters or not? My muscle of my arm had some spasms as it was being injected by her.

3) Before I got my shot, I had to wait a few minutes for it to be drawn up. The problem with this was, I had no idea what was injected in me, as I never saw the vial the “vaccine” was drawn out of. It was very much like the scene at the end of “The Wizard of Oz”, when the wizard came out from behind the curtain; a different nurse came from behind me through these make-shift booth curtains to hand the student nurse a syringe. I asked to see the syringe for any information on it, but all it had on it was a lot #. The nurse said to me, “this is your last chance to back out.” In conversation with her prior while I was waiting, she had told me she had yet to get the vaccine, but it was offered to her as part of the nursing program. She was still undecided to get hers.

4) As I was rushed to the booth, I was handed a 6 page document about the vaccine, that I did not really get to read until I got home later. Maybe it was my naivety about the vaccine, but I did not realize the Pfizer-BioNTech vaccine was not approved by the Food & Drug Administration (FDA) but rather fell under an EUA (Emergency Use Authorization) by the FDA. Under section 564 of the Federal Food, Drug, and Cosmetic Act (FD&C Act), the FDA Commissioner may allow unapproved medical products or unapproved uses of approved medical products to be used in an emergency to diagnose, treat, or prevent serious or life-threatening diseases or conditions caused by CBRN threat agents when there are no adequate, approved, and available alternatives. READ EVERYTHING YOU ARE HANDED BEFORE YOU TAKE THE VACCINE, SO YOU CAN MAKE THE BEST INFORMED DECISION. I might have waited on getting it, had I known this little snippet about it, regardless of the claimed 95% efficacy.

I will update my post, if I experience any more symptoms. 

I am scheduled Feb. 17 for Dose #2. Am praying this was the right decision, despite my objections above.

Good Luck to those thinking about this difficult decision themselves and their families. It was not an easy one for me, even despite having already gotten the vaccine.",2021-01-31 16:54:53
Delayed Symptoms From 1st Dose 5 Days Later,15,l8skoz,https://www.reddit.com/r/PfizerVaccine/comments/l8skoz/delayed_symptoms_from_1st_dose_5_days_later/,18,1612061387.0,"I thought I would share my experience with the first dose of the Pfizer vaccine in case it's more common than I think. I had gotten it last week on Thursday (Jan 21st) and the only early-on symptom I had that I could confirm was from the vaccine was arm soreness at the injection site which was mostly just the day after and really not bad.

Fast forward to Tuesday, I started having really bad chills for a couple of hours while out eating with my Fiance, and checked my temperature when I got home and I was 99.1 (after drinking water so probably actually higher). My temperature stayed in that range for 2 days (Tues and Weds) along with the chills and I clocked it as high as 99.5 when intentionally avoiding water for 30+ minutes to get an accurate reading (yes, I hydrate a LOT). I also had bad chest pain, likely from muscle aches and tightness, and I was pretty convinced I had contacted COVID from my Fiance's coworker who tested positive a couple days prior.

My Fiance and I got tested and both came back negative so I can only assume this was a very delayed reaction to the vaccine, but I felt mostly better by Wednesday so all in all it just lasted about 2 days.",2021-01-31 04:49:47
Big guys are on Pfizer!,15,l8ge6l,https://www.reddit.com/r/PfizerVaccine/comments/l8ge6l/big_guys_are_on_pfizer/,14,1612019699.0,Buy and hold!!!,2021-01-30 17:14:59
2nd dose side effects,19,l8e8kj,https://www.reddit.com/r/PfizerVaccine/comments/l8e8kj/2nd_dose_side_effects/,19,1612011334.0,"First dose was uneventful except for very mild soreness at the injection site. Got my 2nd dose today at 11:30am. Approx 10pm tonight I started feeling some soreness at the injection site (left arm). Over the next hour (now!), I’ve developed chills, joint pain all over my upper body but especially in my left shoulder and arm, and mild headache. Just took some Advil PM and hoping to get some sleep. Will update in the morning.

Edit: chills suddenly stopped about an hour after they started last night and joint pain started subsiding. Feeling pretty normal this morning so far.

2nd edit: day after second vaccine knocked me on my ass! About an hour after I reported “feeling pretty normal” in the morning, I got chills again and my whole body was achy. I was lethargic, had achy joints and a mild headache. Slept a lot off and on most of the day and drank lots of water to stay hydrated. By about 8pm I was feeling much better. It is now 2 days post vaccine and this morning I feel completely fine again except for some mild soreness in the vaccination arm.",2021-01-30 14:55:34
First dose experience 33/M,6,l7vmec,https://www.reddit.com/r/PfizerVaccine/comments/l7vmec/first_dose_experience_33m/,12,1611963622.0,"I jut got yesterday my first dose, feeling fine after 30 minutes, when I start driving home I started to feel dizzy, when i got home I was very dizzy and with a severe headache I couldn't see light or hear mid level noise without pain also started to feel tired , I just took a tylenol and went to sleep the rest of the day, 
Today second day, feeling fine just pain in the arm

Edit: I took the second dose today I'm only feeling very tired, I had sleeped all day lrt see how it goes tomorrow",2021-01-30 01:40:22
"Costco among major retailers that will be offering COVID-19 vaccinations at select stores as they become available, according to the company website. '..those eligible to receive a vaccine will likely need to register to book a vaccination appointment at a Costco in their area'",6,l7pwme,https://www.newsweek.com/coronavirus-costco-covid-vaccine-how-book-vaccination-appointment-register-1564884,2,1611947043.0,,2021-01-29 21:04:03
IM FREAKING OUT,5,l7nc0f,https://www.reddit.com/r/PfizerVaccine/comments/l7nc0f/im_freaking_out/,25,1611937263.0,"Okay for reference I'm a 20-year-old female and I got my first Pfizer dose today. Everything was going fine the only thing that hurts is my arm, however, my heart rate so so insanely high I'm genuinely scared. It's normally 60 and it's at 93...it's 2 am and I'm laying down. I can't sleep because it's beating too fast... I'm really scared and I don't know what to do",2021-01-29 18:21:03
weird side effect after second dose,7,l7d3ao,https://www.reddit.com/r/PfizerVaccine/comments/l7d3ao/weird_side_effect_after_second_dose/,4,1611907013.0,"this was just so crazy i had to share...

i got my second dose of the pfizer vaccine on tuesday, and for the most part felt fine the next day.  even the arm soreness was diminished from the first shot.  last night, however, approximately 30 hours after the shot, i decided to have a snack of chips and salsa.  these were left over from a meal the night before in which i had eaten a ton of both without any problem.  

only three dipped chips into my snack, my tongue started burning SEVERELY.  felt like my mouth was on fire.  i have a very high tolerance for spicy food and this was just some jalapeno based salsa that, as i mentioned, i had a lot of the night before and, if anything, was disappointed with how mild it was.  not so the next night.  my face turned red, my eyes were tearing, and no matter what i tried to do to ease the burn - bread, milk, ice cream - it lasted for nearly 30 minutes.  never experienced anything like that, and i eat habaneros, ghost peppers, etc, whenever i have the opportunity.

the only thing that could have done this is a reaction to the vaccine.  i did some research on capsaicin-induced mouth burn as a possible immune response and couldn't find anything but mentions of spicy food as being good for strengthening the immune system, but that's about it.  it was so weird.  i want to try it again tonight to see if the same thing will happen, but i honestly don't want to go through that again.

anyone heard of this or a physiological mechanism to explain it?  i had a bunch of co-workers who got the second dose today, so i have asked them to try tasting some salsa tomorrow in a mini experiment.  i'll report back if others notice the same effect or i am an isolated case...",2021-01-29 09:56:53
"Biden admin orders additional 200 million doses of Covid-19 vaccine: This is in addition to the 400 million combined doses the companies had already committed to providing to the US, he said. Johnson & Johnson said it will release data for its single-dose vaccine in the coming days.",6,l77s94,https://www.cnbc.com/2021/01/26/biden-administration-orders-additional-200-million-doses-of-vaccine.html,1,1611894472.0,,2021-01-29 06:27:52
My experience 37/f,12,l6vz2x,https://www.reddit.com/r/PfizerVaccine/comments/l6vz2x/my_experience_37f/,2,1611867603.0,"Received my first dose last night at 530. Very quick and not a big deal getting it. I’m usually a fainter, but I was fine. They suggested taking Tylenol when I got home and I did. Woke up a little sore in that arm this morning, but when I say little, hardly at all.

Edited to add: 2/19/21 (Friday) I received my second dose. My arm was a little sore the next day, but not as bad as the first shot. I had a bad headache around midnight on Saturday, could be unrelated, I get them occasionally. No other side effects thank goodness. I have heard some people feeling pretty bad after, so wanted to share that was NOT the case with me. My mom also had both 1st and 2nd dose with no side effects.",2021-01-28 23:00:03
my Pfizer vaccine experience,11,l48m8w,https://www.reddit.com/r/PfizerVaccine/comments/l48m8w/my_pfizer_vaccine_experience/,13,1611554058.0,"I'm really surprised I'm not finding more information about others experience with the vaccine...

I received my first dose on 1/20, and today is 1/24. 

\-On the 20th, my arm felt pretty sore by the end of the day, but when I woke up I didn't feel any soreness. I felt a little out of breath for the few hours after my vaccine. 

\-The past few days I have felt really tired, but I'm not sure if it's due to the vaccine or just general stress. I also started having stomach issues today - nausea, etc. I'm also not sure if this is due to the vaccine.

I will be getting the second dose on 2/12 - so I will update more then!",2021-01-25 07:54:18
Second dose,15,kx253z,https://www.reddit.com/r/PfizerVaccine/comments/kx253z/second_dose/,17,1610644033.0,"*UPDATE - I survived. Last night was rough, but this morning I was fine (other than being exhausted from lack of sleep and a sore arm from the injection site). My supervisor had the opposite experience; she was fine all day yesterday but had to go home within two hours of being at work due to fatigue, nausea, and vomiting. Our program director experienced these side effects after her first dose, but nothing after her second. My advice: try to schedule the shots on days when you are able to rest afterward and the following day; it seems like side effects vary but it would be safer to give yourself some time to recuperate :)

I just received my second dose of the Pfizer vaccine this afternoon at 3:30pm. I felt fine immediately after, and figured I would have a pretty uneventful experience like I did the first time around (had no side effects except for a sore arm the next day). At around 7pm, I started to get a headache that got progressively worse. I laid down for a bit and fell asleep, only to wake up a few hours later with a headache, strong cramps similar to period cramps, and a low grade fever (99.1 temp). I am wondering if anyone else has had a similar experience so far, or if they had to miss work from side effects of the second dose? I’m hoping I’ll be able to sleep it off and be back to normal 8 hours from now when I leave for work.",2021-01-14 19:07:13
Comment,1,gpv6zbx,,0,1615033972.0,First shot today! Arm is sore just like the flu shot. No other symptoms!,2021-03-06 14:32:52
Comment,1,gpuqe99,,0,1615027503.0,"Day 3, first shot. Slight chills (but might be from the cold weather), but otherwise feeling normal",2021-03-06 12:45:03
Comment,1,gpumdhf,,0,1615026082.0,"got my second shot on Tuesday noon. Had a fever from Tue night till Wednesday night. Since then, a mild headache that persists until now (Fri afternoon).",2021-03-06 12:21:22
Comment,1,gpumb7k,,0,1615026057.0,"got my second shot on Tuesday noon. Had a fever from Tue night till Wednesday night. Since then, a mild headache that persists until now (Fri afternoon).",2021-03-06 12:20:57
Comment,1,gpulld2,,0,1615025814.0,Got my dose 1 yesterday and had a mild headache last night.  Worked out today and it went normally.  Hoping to continue this trend with dose two but I’m sure it will be worse,2021-03-06 12:16:54
Comment,1,gpt3vqn,,0,1615001972.0,">Why is there such a heavy push to get vaccinated by the media and political affiliations? And why all of a sudden IS THIS vaccine free to anyone, but other vaccines are not? Who is paying for all of this?

The vaccine is paid for by the first COVID Relief Bill.  The Federal government is paying for it.  Why?  Because the Pandemic is crippling the economy and the vaccine is the only way out.

Why the rush?  Because 530k Americans have already died from it and we are losing thousands daily.  Until 80% of Americans are vaccinated, the Pandemic will continue to rage on.

This is on pace to kill more Americans than any war or any other epidemic in US history.",2021-03-06 05:39:32
Comment,1,gpt3h9a,,0,1615001789.0,Except for the 530k Americans who have already died from it.  This is on pace to becoming the worst epidemic in American history.   675k died from the 1918 flu.,2021-03-06 05:36:29
Comment,1,gpt3b7a,,0,1615001711.0,"Let's just wait 5 years for full data.  Meanwhile, millions of people will die of the Pandemic and our economy will collapse.",2021-03-06 05:35:11
Comment,1,gpstqck,,0,1614997442.0,I did. They sent me a form to fill out additional information. I need to send it back. I still have to do allergy and vestibular testing. I also had an EKG that was normal. I’m doing an echocardiogram to be safe because I thought I was having palpitations but now I think it’s anxiety tremors.,2021-03-06 04:24:02
Comment,2,gpsrqda,,0,1614996565.0,"Fortunately, I have not had the headaches! My MRI, Catscan, bloodwork, first ENT testing all showed nothing - except it showed it was not the BPPV form of vertigo. Glad to hear you are feeling a little better! Keep us posted.   
BTW - have you reported to the CDC  Vaccine Adverse Event Reporting System (VAERS)  site? I am just waiting till after this next ENT appt so I can list all the doctors.  
[https://www.cdc.gov/vaccinesafety/ensuringsafety/monitoring/vaers/index.html](https://www.cdc.gov/vaccinesafety/ensuringsafety/monitoring/vaers/index.html)",2021-03-06 04:09:25
Comment,1,gpsqsua,,0,1614996155.0,Get lots of rest and best of luck.,2021-03-06 04:02:35
Comment,1,gpsqn5h,,0,1614996086.0,That is great! Gives me some hope :),2021-03-06 04:01:26
Comment,1,gpsqbaa,,0,1614995943.0,I started taking prednisone yesterday and my headache was actually a little better. Also did my MRI yesterday. If that comes out clear I guess it will just take time.,2021-03-06 03:59:03
Comment,2,gpsppfa,,0,1614995683.0,How are you doing? I am so over this already! It's been almost 6 weeks for me. I have a 2nd ENT appt on Tuesday but not expecting much of anything and nothing conclusive in any of the tests so far. Feeling like a lab rat and trying to convince myself that this is better than getting covid and possibly dying. Just wish it could go away already!!,2021-03-06 03:54:43
Comment,1,gpspl4h,,0,1614995632.0,"As of today, all symptoms have cleared up.",2021-03-06 03:53:52
Comment,1,gpsoe9c,,0,1614995125.0,"I had a bad pressure in left ear one night - could barely hear out of that ear, either. Went away by morning.  I am going on 6 weeks of waves of what I call dizziness - it is not like room spinning dizzy - hard to describe. Constant tinnitus mostly in left ear and gets worse during bad spells. Seeing ENT next week. Not very optimistic for any real determination or treatment.  
How are you doing since your second shot?",2021-03-06 03:45:25
Comment,1,gpqj5ll,,0,1614945603.0,"1st dose at 10:30AM today. Drove 20 miles to get Pfizer dose, not J&J.

I expect 2nd dose in 3 weeks to be like Prevnar13.

1st dose, fine.... 
Second dose kicks off imune system as a response to antibodies created by 1st dose.

Better than the alternative.",2021-03-05 14:00:03
Comment,1,gpq7oar,,0,1614939367.0,Got my 1st dose today and feel fine.  I did have a strange metallic taste in my mouth for about 4 or 5 hours which is not listed as a side effect.  Arm is slightly sore typical of any shot.,2021-03-05 12:16:07
Comment,1,gpq3v8w,,0,1614937368.0,"27/F chubby with anxiety and adhd. Got mine yesterday. I’m a needle phobe (I can get a flu shot if I decide to go like that day). 
I almost fainted in my car after receiving the shot. Thank goodness for a nice understanding nurse and an observation period because I hate needles!
Had a sore arm pretty much right away (expected that). Also was thirsty but was also expecting that. Was tired but ran small errands afterwards. 

12-24 hours after has felt kinda like a cold/flu or hangover. Been really tired and it’s been hard to focus but I worked. Pretty much have had a little nausea, intermittent 99 F, slight congestion I recognize from stress/allergies, and tiredness all day. Only taken tums for symptoms. 

Trying to go to bed much earlier than usual and hope it clears up soon!

Regardless I actually can’t wait to be able to work on campus again (I’m in education), and am super grateful to be called to get mine.",2021-03-05 11:42:48
Comment,1,gppnqs6,,0,1614929107.0,"34/F/Pregnant. First shot 7 days ago. Slight lightheadedness came on immediately, but was gone within 10 minutes. No other symptoms that day. Experienced persistent headache and injection site pain day 2, including a lump under my skin at the injection site that still hasn't fully gone away and it quite warm to the touch. Otherwise no other symptoms. Going back for shot #2 in two weeks.",2021-03-05 09:25:07
Comment,1,gpopeqh,,0,1614914059.0,Got my first shot almost 24 hours ago. So far so good. Little bit of a lingering headache but nothing major. 🙏🏼,2021-03-05 05:14:19
Comment,0,gpo1etf,,0,1614903867.0,"We have lost .1% of the population in the USA to Covid-19 in over a year. The CARES ACT requires anyone that dies of anything else but covid is present, even it isn’t covid that killed them, must be coded as death by covid. This was SUDDENLY enacted in March of 2020 by the CDC whose major funding comes from Bill Gates. Suddenly, physicians are being told by the CDC how to code deaths. A death from a heart attack can be listed as covid if covid is even present in the hospital.  This allows the hospital to get 20% more in reimbursements from Medicaid. If they even eyeball a ventilator, add $39,000 to the reimbursement. More people die from cigarettes and tobacco products than covid but hey, the tobacco lobby has the government in their back pockets. The government could make cigarettes illegal but they make too much money off tobacco.  Don’t think for a minute that the government or pharmaceutical companies care about how you die. They just want to make money off it. Terrified people are making a lot of companies billions of dollars off fear. Good luck 👍🏼",2021-03-05 02:24:27
Comment,1,gpnpl9e,,0,1614898662.0,🚀🚀🚀🚀🚀🚀,2021-03-05 00:57:42
Comment,1,gpndykn,,0,1614892631.0,"1st jab - sore arm started a few hours after. This discomfort lasted a few days

2nd jab - sore arm first day only . Night of jab I had chills and struggled to sleep. Day after I felt tired/lethargic and slept most of the day. Fine after that though",2021-03-04 23:17:11
Comment,1,gpncv1p,,0,1614891961.0,"Oh man, that’s tough. Try to look on the bright side, you’ve secured your second dose and you’ll be fully vaccinated. Big win! I’ll send some positive vibes your way that you’ll have an easy go of it or maybe even skip the side effects all together! 🤞🏻",2021-03-04 23:06:01
